<?xml version="1.0" encoding="UTF-8"?>
<fichas xmlns:xsi="http://www.w3.org/2001/XMLSchema-instance"
    xsi:noNamespaceSchemaLocation="Ejercicio18_InformacionPersonaAmpliada.xsd">
    <ficha numero="1">
        <nombre>Eva</nombre>
        <edad>25</edad>
        <ciudad>París</ciudad>
        <pais>Francia</pais>
        <telefono>999888777</telefono>
    </ficha>
    <ficha numero="2">
        <nombre>Giovanni</nombre>
        <edad>26</edad>
        <ciudad>Florencia</ciudad>
        <pais>Italia</pais>
        <telefono>111222333</telefono>
    </ficha>
</fichas>